{
  "schemaVersion": "1.0",
  "eventId": "11111111-1111-4111-8111-111111111111",
  "type": "hina.contract.echo.v1",
  "scope": "global",
  "sessionId": null,
  "turnId": null,
  "correlationId": "22222222-2222-4222-8222-222222222222",
  "causationId": null,
  "source": "contracts.test",
  "trustLevel": "trusted_local",
  "occurredAt": "2026-07-24T00:00:00Z",
  "expiresAt": null,
  "deadline": null,
  "idempotencyKey": null,
  "streamId": null,
  "sequence": null,
  "media": [],
  "payload": {
    "message": "Xin chao Hina",
    "locale": "vi-VN",
    "tags": [
      "golden"
    ],
    "metadata": {
      "fixture": "global"
    }
  }
}
